year,issue,part,authors,article,url,data_url
2007,21.3,Articles,"Benmelech, Efraim | Berrebi, Claude",Human Capital and the Productivity of Suicide Bombers,https://www.aeaweb.org/atypon.php?return_to=/doi/pdfplus/10.1257%2Fjep.21.3.223,
2007,21.3,Features,"Taylor, Timothy",Recommendations for Further Reading,https://www.aeaweb.org/atypon.php?return_to=/doi/pdfplus/10.1257%2Fjep.21.3.239,
2007,21.3,Features,,Notes,https://www.aeaweb.org/atypon.php?return_to=/doi/pdfplus/10.1257%2Fjep.21.3.247,
2007,21.4,Symposium: Monetary Policy,"Woodford, Michael",The Case for Forecast Targeting as a Monetary Policy Strategy,https://www.aeaweb.org/atypon.php?return_to=/doi/pdfplus/10.1257%2Fjep.21.4.3,
2007,21.4,Symposium: Monetary Policy,"Gal, Jordi | Gertler, Mark",Macroeconomic Modeling for Monetary Policy Evaluation,https://www.aeaweb.org/atypon.php?return_to=/doi/pdfplus/10.1257%2Fjep.21.4.25,
2007,21.4,Symposium: Monetary Policy,"Goodfriend, Marvin",How the World Achieved Consensus on Monetary Policy,https://www.aeaweb.org/atypon.php?return_to=/doi/pdfplus/10.1257%2Fjep.21.4.47,
2007,21.4,Symposium: Monetary Policy,"Crowe, Christopher | Meade, Ellen",The Evolution of Central Bank Governance around the World,https://www.aeaweb.org/atypon.php?return_to=/doi/pdfplus/10.1257%2Fjep.21.4.69,
2007,21.4,Symposium: Human Resource Management,"Lazear, Edward | Shaw, Kathryn",Personnel Economics: The Economist's View of Human Resources,https://www.aeaweb.org/atypon.php?return_to=/doi/pdfplus/10.1257%2Fjep.21.4.91,
2007,21.4,Symposium: Human Resource Management,"Pfeffer, Jeffrey",Human Resources from an Organizational Behavior Perspective: Some Paradoxes Explained,https://www.aeaweb.org/atypon.php?return_to=/doi/pdfplus/10.1257%2Fjep.21.4.115,
2007,21.4,Symposium: Human Resource Management,"Ellingsen, Tore | Johannesson, Magnus",Paying Respect,https://www.aeaweb.org/atypon.php?return_to=/doi/pdfplus/10.1257%2Fjep.21.4.135,
2007,21.4,Articles,"Anderson, Siwan",The Economics of Dowry and Brideprice,https://www.aeaweb.org/atypon.php?return_to=/doi/pdfplus/10.1257%2Fjep.21.4.151,
2007,21.4,Articles,"White, Michelle",Bankruptcy Reform and Credit Cards,https://www.aeaweb.org/atypon.php?return_to=/doi/pdfplus/10.1257%2Fjep.21.4.175,
2007,21.4,Features,"Harrington, David",Markets: Preserving Funeral Markets with Ready-to-Embalm Laws,https://www.aeaweb.org/atypon.php?return_to=/doi/pdfplus/10.1257%2Fjep.21.4.201,
2007,21.4,Features,"Sandmo, Agnar",Retrospectives: Lon Walras and the Nobel Peace Prize,https://www.aeaweb.org/atypon.php?return_to=/doi/pdfplus/10.1257%2Fjep.21.4.217,
2007,21.4,Features,"Taylor, Timothy",Recommendations for Further Reading,https://www.aeaweb.org/atypon.php?return_to=/doi/pdfplus/10.1257%2Fjep.21.4.229,
2007,21.4,Features,,Corrections,https://www.aeaweb.org/atypon.php?return_to=/doi/pdfplus/10.1257%2Fjep.21.4.237,
2007,21.4,Features,,Notes,https://www.aeaweb.org/atypon.php?return_to=/doi/pdfplus/10.1257%2Fjep.21.4.239,
2007,21.4,Features,,Index by Author to Volume 21,https://www.aeaweb.org/atypon.php?return_to=/doi/pdfplus/10.1257%2Fjep.21.4.243,
2008,22.1,Symposium: Productivity,"Jorgenson, Dale | Ho, Mun | Stiroh, Kevin",A Retrospective Look at the U.S. Productivity Growth Resurgence,https://www.aeaweb.org/atypon.php?return_to=/doi/pdfplus/10.1257%2Fjep.22.1.3,
2008,22.1,Symposium: Productivity,"van Ark, Bart | O'Mahoney, Mary | Timmer, Marcel",The Productivity Gap between Europe and the United States: Trends and Causes,https://www.aeaweb.org/atypon.php?return_to=/doi/pdfplus/10.1257%2Fjep.22.1.25,
2008,22.1,Symposium: Productivity,"Bosworth, Barry | Collins, Susan",Accounting for Growth: Comparing China and India,https://www.aeaweb.org/atypon.php?return_to=/doi/pdfplus/10.1257%2Fjep.22.1.45,
2008,22.1,Symposium: Regulatory Economics,"Hahn, Robert | Tetlock, Paul",Has Economic Analysis Improved Regulatory Decisions?,https://www.aeaweb.org/atypon.php?return_to=/doi/pdfplus/10.1257%2Fjep.22.1.67,
2008,22.1,Symposium: Regulatory Economics,"Philipson, Tomas | Sun, Eric",Is the Food And Drug Administration Safe And Effective?,https://www.aeaweb.org/atypon.php?return_to=/doi/pdfplus/10.1257%2Fjep.22.1.85,
2008,22.1,Symposium: Regulatory Economics,"Hazlett, Thomas",Optimal Abolition of FCC Spectrum Allocation,https://www.aeaweb.org/atypon.php?return_to=/doi/pdfplus/10.1257%2Fjep.22.1.103,
2008,22.1,Articles,"Steckel, Richard",Biological Measures of the Standard of Living,https://www.aeaweb.org/atypon.php?return_to=/doi/pdfplus/10.1257%2Fjep.22.1.129,
2008,22.1,Articles,"Hirsch, Barry",Sluggish Institutions in a Dynamic World: Can Unions and Industrial Competition Coexist?,https://www.aeaweb.org/atypon.php?return_to=/doi/pdfplus/10.1257%2Fjep.22.1.153,
2008,22.1,Articles,"Brown, Jeffrey",Guaranteed Trouble: The Economic Effects of the Pension Benefit Guaranty Corporation,https://www.aeaweb.org/atypon.php?return_to=/doi/pdfplus/10.1257%2Fjep.22.1.177,
2008,22.1,Articles,"Tokarick, Stephen",Dispelling Some Misconceptions about Agricultural Trade Liberalization,https://www.aeaweb.org/atypon.php?return_to=/doi/pdfplus/10.1257%2Fjep.22.1.199,
2008,22.1,Features,"Syverson, Chad",Markets: Ready-Mixed Concrete,https://www.aeaweb.org/atypon.php?return_to=/doi/pdfplus/10.1257%2Fjep.22.1.217,
2008,22.1,Features,"Taylor, Timothy",Recommendations for Further Reading,https://www.aeaweb.org/atypon.php?return_to=/doi/pdfplus/10.1257%2Fjep.22.1.235,
2008,22.1,Features,,"Comments: Robert Solow, Murray Wiedenbaum, V. V. Chari, and Patrick J. Kehoe",https://www.aeaweb.org/atypon.php?return_to=/doi/pdfplus/10.1257%2Fjep.22.1.243,
2008,22.1,Features,,Notes,https://www.aeaweb.org/atypon.php?return_to=/doi/pdfplus/10.1257%2Fjep.22.1.251,
2008,22.2,Symposium: Development,"Banerjee, Abhijit | Duflo, Esther",What Is Middle Class about the Middle Classes around the World?,https://www.aeaweb.org/atypon.php?return_to=/doi/pdfplus/10.1257%2Fjep.22.2.3,
2008,22.2,Symposium: Development,"Easterly, William | Pfutze, Tobias",Where Does the Money Go? Best and Worst Practices in Foreign Aid,https://www.aeaweb.org/atypon.php?return_to=/doi/pdfplus/10.1257%2Fjep.22.2.29,
2008,22.2,Symposium: Development,"Deaton, Angus","Income, Health, and Well-Being around the World: Evidence from the Gallup World Poll",https://www.aeaweb.org/atypon.php?return_to=/doi/pdfplus/10.1257%2Fjep.22.2.53,
2008,22.2,Symposium: Development,"Werker, Eric | Ahmed, Faisal Z.",What Do Nongovernmental Organizations Do?,https://www.aeaweb.org/atypon.php?return_to=/doi/pdfplus/10.1257%2Fjep.22.2.73,
2008,22.2,Symposium: Development,"Das, Jishnu | Hammer, Jeffrey | Leonard, Kenneth",The Quality of Medical Advice in Low-Income Countries,https://www.aeaweb.org/atypon.php?return_to=/doi/pdfplus/10.1257%2Fjep.22.2.93,
2008,22.2,Symposium: Economics of Persuasion,"Milgrom, Paul",What the Seller Won't Tell You: Persuasion and Disclosure in Markets,https://www.aeaweb.org/atypon.php?return_to=/doi/pdfplus/10.1257%2Fjep.22.2.115,
2008,22.2,Symposium: Economics of Persuasion,"Gentzkow, Matthew | Shapiro, Jesse M.",Competition and Truth in the Market for News,https://www.aeaweb.org/atypon.php?return_to=/doi/pdfplus/10.1257%2Fjep.22.2.133,
2008,22.2,Symposium: Economics of Persuasion,"Leeson, Peter T.","Media Freedom, Political Knowledge, and Participation",https://www.aeaweb.org/atypon.php?return_to=/doi/pdfplus/10.1257%2Fjep.22.2.155,
2008,22.2,Articles,"Anderson, Keith B. | Durbin, Erik | Salinger, Michael A.",Identity Theft,https://www.aeaweb.org/atypon.php?return_to=/doi/pdfplus/10.1257%2Fjep.22.2.171,
2008,22.2,Articles,"Landefeld, J. Steven | Seskin, Eugene P. | Fraumeni, Barbara M.",Taking the Pulse of the Economy: Measuring GDP,https://www.aeaweb.org/atypon.php?return_to=/doi/pdfplus/10.1257%2Fjep.22.2.193,
2008,22.2,Features,"Bessembinder, Hendrik | Maxwell, William",Markets: Transparency and the Corporate Bond Market,https://www.aeaweb.org/atypon.php?return_to=/doi/pdfplus/10.1257%2Fjep.22.2.217,
2008,22.2,Features,"Taylor, Timothy",Recommendations for Further Reading,https://www.aeaweb.org/atypon.php?return_to=/doi/pdfplus/10.1257%2Fjep.22.2.235,
2008,22.2,Features,"Dijkgraaf, Elbert | Gradus, Raymond | Kinnaman, Thomas | Jorgenson, Dale W. | Ho, Mun S. | Stiroh, Kevin J.","Comments: Elbert Dijkgraaf and Raymond Gradus, Thomas Kinnaman; and a Correction",https://www.aeaweb.org/atypon.php?return_to=/doi/pdfplus/10.1257%2Fjep.22.2.243,
2008,22.2,Features,,Notes,https://www.aeaweb.org/atypon.php?return_to=/doi/pdfplus/10.1257%2Fjep.22.2.247,
2008,22.3,Symposium: Investment in Children,"Feyrer, James | Sacerdote, Bruce | Stern, Ariel Dora",Will the Stork Return to Europe and Japan? Understanding Fertility within Developed Nations,https://www.aeaweb.org/atypon.php?return_to=/doi/pdfplus/10.1257%2Fjep.22.3.3,
2008,22.3,Symposium: Investment in Children,"Guryan, Jonathan | Hurst, Erik | Kearney, Melissa",Parental Education and Parental Time with Children,https://www.aeaweb.org/atypon.php?return_to=/doi/pdfplus/10.1257%2Fjep.22.3.23,
2008,22.3,Symposium: Investment in Children,"Cascio, Elizabeth | Clark, Damon | Gordon, Nora",Education and the Age Profile of Literacy into Adulthood,https://www.aeaweb.org/atypon.php?return_to=/doi/pdfplus/10.1257%2Fjep.22.3.47,
2008,22.3,Symposium: Investment in Children,"Deming, David | Dynarski, Susan",The Lengthening of Childhood,https://www.aeaweb.org/atypon.php?return_to=/doi/pdfplus/10.1257%2Fjep.22.3.71,
2008,22.3,Symposium: U.S. Trade Deficit,"Cooper, Richard N.","Global Imbalances: Globalization, Demography, and Sustainability",https://www.aeaweb.org/atypon.php?return_to=/doi/pdfplus/10.1257%2Fjep.22.3.93,
2008,22.3,Symposium: U.S. Trade Deficit,"Feldstein, Martin",Resolving the Global Imbalance: The Dollar and the U.S. Saving Rate,https://www.aeaweb.org/atypon.php?return_to=/doi/pdfplus/10.1257%2Fjep.22.3.113,
2008,22.3,Articles,"Ritter, Jay R.",Forensic Finance,https://www.aeaweb.org/atypon.php?return_to=/doi/pdfplus/10.1257%2Fjep.22.3.127,
2008,22.3,Articles,"Prasad, Eswar S. | Rajan, Raghuram G.",A Pragmatic Approach to Capital Account Liberalization,https://www.aeaweb.org/atypon.php?return_to=/doi/pdfplus/10.1257%2Fjep.22.3.149,
2008,22.3,Articles,"Gilboa, Itzhak | Postlewaite, Andrew W. | Schmeidler, David",Probability and Uncertainty in Economic Modeling,https://www.aeaweb.org/atypon.php?return_to=/doi/pdfplus/10.1257%2Fjep.22.3.173,
2008,22.3,Articles,"Kremer, Michael | Levy, Dan",Peer Effects and Alcohol Use among College Students,https://www.aeaweb.org/atypon.php?return_to=/doi/pdfplus/10.1257%2Fjep.22.3.189,
2008,22.3,Articles,"Lerner, Josh | Schoar, Antoinette | Wang, Jialan",Secrets of the Academy: The Drivers of University Endowment Success,https://www.aeaweb.org/atypon.php?return_to=/doi/pdfplus/10.1257%2Fjep.22.3.207,
2008,22.3,Features,"Taylor, Timothy",Recommendations for Further Reading,https://www.aeaweb.org/atypon.php?return_to=/doi/pdfplus/10.1257%2Fjep.22.3.223,
2008,22.3,Features,,Notes,https://www.aeaweb.org/atypon.php?return_to=/doi/pdfplus/10.1257%2Fjep.22.3.231,
2008,22.4,Symposium: Health Care,"Cutler, David M.",Are We Finally Winning the War on Cancer?,https://www.aeaweb.org/atypon.php?return_to=/doi/pdfplus/10.1257%2Fjep.22.4.3,
2008,22.4,Symposium: Health Care,"Garber, Alan M. | Skinner, Jonathan",Is American Health Care Uniquely Inefficient?,https://www.aeaweb.org/atypon.php?return_to=/doi/pdfplus/10.1257%2Fjep.22.4.27,
2008,22.4,Symposium: Health Care,"Gruber, Jonathan",Incremental Universalism for the United States: The States Move First?,https://www.aeaweb.org/atypon.php?return_to=/doi/pdfplus/10.1257%2Fjep.22.4.51,
2008,22.4,Symposium: Health Care,"Duggan, Mark | Healy, Patrick | Scott Morton, Fiona",Providing Prescription Drug Coverage to the Elderly: America's Experiment with Medicare Part D,https://www.aeaweb.org/atypon.php?return_to=/doi/pdfplus/10.1257%2Fjep.22.4.69,
2008,22.4,Symposium: Health Care,"Cebul, Randall D. | Rebitzer, James B. | Taylor, Lowell J. | Votruba, Mark E.",Organizational Fragmentation and Care Quality in the U.S. Healthcare System,https://www.aeaweb.org/atypon.php?return_to=/doi/pdfplus/10.1257%2Fjep.22.4.93,
2008,22.4,Articles,"Weil, Philippe",Overlapping Generations: The First Jubilee,https://www.aeaweb.org/atypon.php?return_to=/doi/pdfplus/10.1257%2Fjep.22.4.115,
2008,22.4,Articles,"Vigdor, Jacob",The Economic Aftermath of Hurricane Katrina,https://www.aeaweb.org/atypon.php?return_to=/doi/pdfplus/10.1257%2Fjep.22.4.135,
2008,22.4,Articles,"Davis, Steven J. | Kahn, James A.",Interpreting the Great Moderation: Changes in the Volatility of Economic Activity at the Macro and Micro Levels,https://www.aeaweb.org/atypon.php?return_to=/doi/pdfplus/10.1257%2Fjep.22.4.155,
2008,22.4,Articles,"Roberts, John",Susan C. Athey: John Bates Clark Award Winner 2007,https://www.aeaweb.org/atypon.php?return_to=/doi/pdfplus/10.1257%2Fjep.22.4.181,
2008,22.4,Features,"Ziliak, Stephen T.","Retrospectives: Guinnessometrics: The Economic Foundation of ""Student's"" t",https://www.aeaweb.org/atypon.php?return_to=/doi/pdfplus/10.1257%2Fjep.22.4.199,
2008,22.4,Features,"Taylor, Timothy",Recommendations for Further Reading,https://www.aeaweb.org/atypon.php?return_to=/doi/pdfplus/10.1257%2Fjep.22.4.217,
2008,22.4,Features,"Tempelman, Jerry H. | Bessembinder, Hendrik | Maxwell, William",Comments,https://www.aeaweb.org/atypon.php?return_to=/doi/pdfplus/10.1257%2Fjep.22.4.225,
2008,22.4,Features,,Notes,https://www.aeaweb.org/atypon.php?return_to=/doi/pdfplus/10.1257%2Fjep.22.4.227,
2009,23.1,Symposium: Early Stages of the Credit Crunch,"Coval, Joshua | Jurek, Jakub | Stafford, Erik",The Economics of Structured Finance,https://www.aeaweb.org/atypon.php?return_to=/doi/pdfplus/10.1257%2Fjep.23.1.3,
2009,23.1,Symposium: Early Stages of the Credit Crunch,"Mayer, Christopher | Pence, Karen | Sherlund, Shane M.",The Rise in Mortgage Defaults,https://www.aeaweb.org/atypon.php?return_to=/doi/pdfplus/10.1257%2Fjep.23.1.27,
2009,23.1,Symposium: Early Stages of the Credit Crunch,"Cecchetti, Stephen G.",Crisis and Responses: The Federal Reserve in the Early Stages of the Financial Crisis,https://www.aeaweb.org/atypon.php?return_to=/doi/pdfplus/10.1257%2Fjep.23.1.51,
2009,23.1,Symposium: Early Stages of the Credit Crunch,"Brunnermeier, Markus K.",Deciphering the Liquidity and Credit Crunch 2007-2008,https://www.aeaweb.org/atypon.php?return_to=/doi/pdfplus/10.1257%2Fjep.23.1.77,
2009,23.1,Symposium: Early Stages of the Credit Crunch,"Shin, Hyun Song",Reflections on Northern Rock: The Bank Run That Heralded the Global Financial Crisis,https://www.aeaweb.org/atypon.php?return_to=/doi/pdfplus/10.1257%2Fjep.23.1.101,
2009,23.1,Symposium: Private Equity,"Kaplan, Steven N. | Stromberg, Per",Leveraged Buyouts and Private Equity,https://www.aeaweb.org/atypon.php?return_to=/doi/pdfplus/10.1257%2Fjep.23.1.121,
2009,23.1,Symposium: Private Equity,"Phalippou, Ludovic",Beware of Venturing into Private Equity,https://www.aeaweb.org/atypon.php?return_to=/doi/pdfplus/10.1257%2Fjep.23.1.147,
2009,23.1,Articles,"Cull, Robert | Asli Demirg-Kunt, Asli | Morduch, Jonathan",Microfinance Meets the Market,https://www.aeaweb.org/atypon.php?return_to=/doi/pdfplus/10.1257%2Fjep.23.1.167,
2009,23.1,Articles,"DeLong, J. Bradford | Magin, Konstantin","The U.S. Equity Return Premium: Past, Present, and Future",https://www.aeaweb.org/atypon.php?return_to=/doi/pdfplus/10.1257%2Fjep.23.1.193,
2009,23.1,Features,"Edelman, Benjamin",Markets: Red Light States: Who Buys Online Adult Entertainment?,https://www.aeaweb.org/atypon.php?return_to=/doi/pdfplus/10.1257%2Fjep.23.1.209,
2009,23.1,Features,"Backhouse, Roger E. | Medema, Steven G.",Retrospectives: On the Definition of Economics,https://www.aeaweb.org/atypon.php?return_to=/doi/pdfplus/10.1257%2Fjep.23.1.221,
2009,23.1,Features,"Taylor, Timothy",Recommendations for Further Reading,https://www.aeaweb.org/atypon.php?return_to=/doi/pdfplus/10.1257%2Fjep.23.1.235,
2009,23.1,Features,,Comments: Ramesh Ramankutty; Erik Berglof; and William Easterly and Tobias Pfutze,https://www.aeaweb.org/atypon.php?return_to=/doi/pdfplus/10.1257%2Fjep.23.1.243,
2009,23.1,Features,,Notes,https://www.aeaweb.org/atypon.php?return_to=/doi/pdfplus/10.1257%2Fjep.23.1.247,
2009,23.2,Front Matter,"Autor, David H.",Note from the Editor: Online Comments for American Economic Association Journals,https://www.aeaweb.org/atypon.php?return_to=/doi/pdfplus/10.1257%2Fjep.23.2.3,
2009,23.2,Symposium: Climate Change,"Metcalf, Gilbert E.",Market-Based Policy Options to Control U.S. Greenhouse Gas Emissions,https://www.aeaweb.org/atypon.php?return_to=/doi/pdfplus/10.1257%2Fjep.23.2.5,
2009,23.2,Symposium: Climate Change,"Tol, Richard S. J.",The Economic Effects of Climate Change,https://www.aeaweb.org/atypon.php?return_to=/doi/pdfplus/10.1257%2Fjep.23.2.29,
2009,23.2,Symposium: Climate Change,"Barrett, Scott",The Coming Global Climate-Technology Revolution,https://www.aeaweb.org/atypon.php?return_to=/doi/pdfplus/10.1257%2Fjep.23.2.53,
2009,23.2,Symposium: Price Variation for Households,"Broda, Christian | Leibtag, Ephraim | Weinstein, David E.",The Role of Prices in Measuring the Poor's Living Standards,https://www.aeaweb.org/atypon.php?return_to=/doi/pdfplus/10.1257%2Fjep.23.2.77,
2009,23.2,Symposium: Price Variation for Households,"Griffith, Rachel | Leibtag, Ephraim | Leicester, Andrew | Nevo, Aviv",Consumer Shopping Behavior: How Much Do Consumers Save?,https://www.aeaweb.org/atypon.php?return_to=/doi/pdfplus/10.1257%2Fjep.23.2.99,
2009,23.2,Articles,"Weld, William C. | Michaely, Roni | Thaler, Richard H. | Benartzi, Shlomo",The Nominal Share Price Puzzle,https://www.aeaweb.org/atypon.php?return_to=/doi/pdfplus/10.1257%2Fjep.23.2.121,
2009,23.2,Articles,"Guriev, Sergei | Zhuravskaya, Ekaterina",(Un)happiness in Transition,https://www.aeaweb.org/atypon.php?return_to=/doi/pdfplus/10.1257%2Fjep.23.2.143,
2009,23.2,Articles,"Johnson, William R. | Turner, Sarah",Faculty without Students: Resource Allocation in Higher Education,https://www.aeaweb.org/atypon.php?return_to=/doi/pdfplus/10.1257%2Fjep.23.2.169,
2009,23.2,Articles,"Stephenson, Matthew C.",Legal Realism for Economists,https://www.aeaweb.org/atypon.php?return_to=/doi/pdfplus/10.1257%2Fjep.23.2.191,
2009,23.2,Features,"White, Michael V. | Schuler, Kurt","Retrospectives: Who Said ""Debauch the Currency"": Keynes or Lenin?",https://www.aeaweb.org/atypon.php?return_to=/doi/pdfplus/10.1257%2Fjep.23.2.213,
2009,23.2,Features,"Taylor, Timothy",Recommendations for Further Reading,https://www.aeaweb.org/atypon.php?return_to=/doi/pdfplus/10.1257%2Fjep.23.2.223,
2009,23.2,Features,,Notes,https://www.aeaweb.org/atypon.php?return_to=/doi/pdfplus/10.1257%2Fjep.23.2.231,
2009,23.3,Front Matter,,Front Matter,https://www.aeaweb.org/atypon.php?return_to=/doi/pdfplus/10.1257%2Fjep.23.3.i,
2009,23.3,Symposium: Internet Economics,"Moore, Tyler | Clayton, Richard | Anderson, Ross",The Economics of Online Crime,https://www.aeaweb.org/atypon.php?return_to=/doi/pdfplus/10.1257%2Fjep.23.3.3,
2009,23.3,Symposium: Internet Economics,"Edelman, Benjamin",Priced and Unpriced Online Markets,https://www.aeaweb.org/atypon.php?return_to=/doi/pdfplus/10.1257%2Fjep.23.3.21,
2009,23.3,Symposium: Internet Economics,"Evans, David S.","The Online Advertising Industry: Economics, Evolution, and Privacy",https://www.aeaweb.org/atypon.php?return_to=/doi/pdfplus/10.1257%2Fjep.23.3.37,
2009,23.3,Symposium: Internet Economics,"Lee, Robin S. | Wu, Tim",Subsidizing Creativity through Network Design: Zero-Pricing and Net Neutrality,https://www.aeaweb.org/atypon.php?return_to=/doi/pdfplus/10.1257%2Fjep.23.3.61,
2009,23.3,Symposium: Grade Differences and Inflation,"Achen, Alexandra C. | Courant, Paul N.",What Are Grades Made Of?,https://www.aeaweb.org/atypon.php?return_to=/doi/pdfplus/10.1257%2Fjep.23.3.77,
2009,23.3,Symposium: Grade Differences and Inflation,"Bar, Talia | Kadiyali, Vrinda | Zussman, Asaf",Grade Information and Grade Inflation: The Cornell Experiment,https://www.aeaweb.org/atypon.php?return_to=/doi/pdfplus/10.1257%2Fjep.23.3.93,
2009,23.3,Articles,"Vane, Howard R. | Mulhearn, Chris",Interview with Edmund S. Phelps,https://www.aeaweb.org/atypon.php?return_to=/doi/pdfplus/10.1257%2Fjep.23.3.109,
2009,23.3,Articles,"Rysman, Marc",The Economics of Two-Sided Markets,https://www.aeaweb.org/atypon.php?return_to=/doi/pdfplus/10.1257%2Fjep.23.3.125,
2009,23.3,Articles,"Smith, James L.",World Oil: Market or Mayhem?,https://www.aeaweb.org/atypon.php?return_to=/doi/pdfplus/10.1257%2Fjep.23.3.145,
2009,23.3,Articles,"Rauch, James E. | Kostyshak, Scott",The Three Arab Worlds,https://www.aeaweb.org/atypon.php?return_to=/doi/pdfplus/10.1257%2Fjep.23.3.165,
2009,23.3,Features,"May, Ann Mari | Dimand, Robert W.",Retrospectives: Trouble in the Inaugural Issue of the American Economic Review: The Cross/Eaves Controversy,https://www.aeaweb.org/atypon.php?return_to=/doi/pdfplus/10.1257%2Fjep.23.3.189,
2009,23.3,Features,"Taylor, Timothy",Recommendations for Further Reading,https://www.aeaweb.org/atypon.php?return_to=/doi/pdfplus/10.1257%2Fjep.23.3.205,
2009,23.3,Features,,Notes,https://www.aeaweb.org/atypon.php?return_to=/doi/pdfplus/10.1257%2Fjep.23.3.213,
2009,23.4,Front Matter,,Front Matter,https://www.aeaweb.org/atypon.php?return_to=/doi/pdfplus/10.1257%2Fjep.23.4.i,
2009,23.4,Symposium: Household Risks,"Gottschalk, Peter | Moffitt, Robert",The Rising Instability of U.S. Earnings,https://www.aeaweb.org/atypon.php?return_to=/doi/pdfplus/10.1257%2Fjep.23.4.3,
2009,23.4,Symposium: Household Risks,"Gruber, Jonathan | Levy, Helen",The Evolution of Medical Spending Risk,https://www.aeaweb.org/atypon.php?return_to=/doi/pdfplus/10.1257%2Fjep.23.4.25,
2009,23.4,Symposium: Household Risks,"Dynan, Karen E.",Changing Household Financial Opportunities and Economic Security,https://www.aeaweb.org/atypon.php?return_to=/doi/pdfplus/10.1257%2Fjep.23.4.49,https://www.aeaweb.org/jep/app/2304_dynan_data_appendix.pdf
2009,23.4,Symposium: Household Risks,"Hallock, Kevin F.",Job Loss and the Fraying of the Implicit Employment Contract,https://www.aeaweb.org/atypon.php?return_to=/doi/pdfplus/10.1257%2Fjep.23.4.69,
2009,23.4,Symposium: College Admissions,"Hoxby, Caroline M.",The Changing Selectivity of American Colleges,https://www.aeaweb.org/atypon.php?return_to=/doi/pdfplus/10.1257%2Fjep.23.4.95,
2009,23.4,Symposium: College Admissions,"Bound, John | Hershbein, Brad | Long, Bridget Terry",Playing the Admissions Game: Student Reactions to Increasing College Competition,https://www.aeaweb.org/atypon.php?return_to=/doi/pdfplus/10.1257%2Fjep.23.4.119,https://www.aeaweb.org/jep/app/2304_Bound_Hershbein_Long_data_appendix.pdf
2009,23.4,Articles,"Mankiw, N. Gregory | Weinzierl, Matthew | Yagan, Danny",Optimal Taxation in Theory and Practice,https://www.aeaweb.org/atypon.php?return_to=/doi/pdfplus/10.1257%2Fjep.23.4.147,
2009,23.4,Articles,"Peltzman, Sam",Mortality Inequality,https://www.aeaweb.org/atypon.php?return_to=/doi/pdfplus/10.1257%2Fjep.23.4.175,
2009,23.4,Articles,"Novy-Marx, Robert | Rauh, Joshua D.",The Liabilities and Risks of State-Sponsored Pension Plans,https://www.aeaweb.org/atypon.php?return_to=/doi/pdfplus/10.1257%2Fjep.23.4.191,
2009,23.4,Articles,"Rockoff, Jonah",Field Experiments in Class Size from the Early Twentieth Century,https://www.aeaweb.org/atypon.php?return_to=/doi/pdfplus/10.1257%2Fjep.23.4.211,
2009,23.4,Features,"Taylor, Timothy",Recommendations for Further Reading,https://www.aeaweb.org/atypon.php?return_to=/doi/pdfplus/10.1257%2Fjep.23.4.231,
2009,23.4,Features,"Johnston, Carl",The Shrinking Medicare Part D Benefit: Comment,https://www.aeaweb.org/atypon.php?return_to=/doi/pdfplus/10.1257%2Fjep.23.4.239,
2009,23.4,Features,,Notes,https://www.aeaweb.org/atypon.php?return_to=/doi/pdfplus/10.1257%2Fjep.23.4.241,
2010,24.1,Front Matter,,Front Matter,https://www.aeaweb.org/atypon.php?return_to=/doi/pdfplus/10.1257%2Fjep.24.1.i,
2010,24.1,Symposium: Financial Plumbing,"Krishnamurthy, Arvind",How Debt Markets Have Malfunctioned in the Crisis,https://www.aeaweb.org/atypon.php?return_to=/doi/pdfplus/10.1257%2Fjep.24.1.3,
2010,24.1,Symposium: Financial Plumbing,"Kacperczyk, Marcin | Schnabl, Philipp",When Safe Proved Risky: Commercial Paper during the Financial Crisis of 2007-2009,https://www.aeaweb.org/atypon.php?return_to=/doi/pdfplus/10.1257%2Fjep.24.1.29,
2010,24.1,Symposium: Financial Plumbing,"Duffie, Darrell",The Failure Mechanics of Dealer Banks,https://www.aeaweb.org/atypon.php?return_to=/doi/pdfplus/10.1257%2Fjep.24.1.51,
2010,24.1,Symposium: Financial Plumbing,"Stulz, Rene M.",Credit Default Swaps and the Credit Crisis,https://www.aeaweb.org/atypon.php?return_to=/doi/pdfplus/10.1257%2Fjep.24.1.73,
2010,24.1,Symposium: Financial Plumbing,"Laux, Christian | Leuz, Christian",Did Fair-Value Accounting Contribute to the Financial Crisis?,https://www.aeaweb.org/atypon.php?return_to=/doi/pdfplus/10.1257%2Fjep.24.1.93,
2010,24.1,Symposium: Retirement and Work Choices,"Rohwedder, Susann | Willis, Robert J.",Mental Retirement,https://www.aeaweb.org/atypon.php?return_to=/doi/pdfplus/10.1257%2Fjep.24.1.119,
2010,24.1,Symposium: Retirement and Work Choices,"Maestas, Nicole | Zissimopoulos, Julie",How Longer Work Lives Ease the Crunch of Population Aging,https://www.aeaweb.org/atypon.php?return_to=/doi/pdfplus/10.1257%2Fjep.24.1.139,
2010,24.1,Symposium: Retirement and Work Choices,"Gustman, Alan L. | Steinmeier, Thomas L. | Tabatabai, Nahid",What the Stock Market Decline Means for the Financial Security and Retirement Choices of the Near-Retirement Population,https://www.aeaweb.org/atypon.php?return_to=/doi/pdfplus/10.1257%2Fjep.24.1.161,
2010,24.1,Articles,"Caplin, Andrew | Leahy, John","Economic Theory and the World of Practice: A Celebration of the (S, s) Model",https://www.aeaweb.org/atypon.php?return_to=/doi/pdfplus/10.1257%2Fjep.24.1.183,
