year,issue,part,authors,article,url,data_url
1994,8.1,Symposium: New Growth Theory,"Solow, Robert M.",Perspectives on Growth Theory,https://www.aeaweb.org/atypon.php?return_to=/doi/pdfplus/10.1257%2Fjep.8.1.45,
1994,8.1,Symposium: New Growth Theory,"Pack, Howard",Endogenous Growth Theory: Intellectual Appeal and Empirical Shortcomings,https://www.aeaweb.org/atypon.php?return_to=/doi/pdfplus/10.1257%2Fjep.8.1.55,
1994,8.1,Symposium: Generational Accounting,"Auerbach, Alan J. | Gokhale, Jagadeesh | Kotlikoff, Laurence J.",Generational Accounting: A Meaningful Way to Evaluate Fiscal Policy,https://www.aeaweb.org/atypon.php?return_to=/doi/pdfplus/10.1257%2Fjep.8.1.73,
1994,8.1,Symposium: Generational Accounting,"Haveman, Robert",Should Generational Accounts Replace Public Budgets and Deficits?,https://www.aeaweb.org/atypon.php?return_to=/doi/pdfplus/10.1257%2Fjep.8.1.95,
1994,8.1,Articles,"Smith, Vernon L.",Economics in the Laboratory,https://www.aeaweb.org/atypon.php?return_to=/doi/pdfplus/10.1257%2Fjep.8.1.113,
1994,8.1,Articles,"Barthold, Thomas A.",Issues in the Design of Environmental Excise Taxes,https://www.aeaweb.org/atypon.php?return_to=/doi/pdfplus/10.1257%2Fjep.8.1.133,
1994,8.1,Articles,"Hamermesh, Daniel S.",Facts and Myths about Refereeing,https://www.aeaweb.org/atypon.php?return_to=/doi/pdfplus/10.1257%2Fjep.8.1.153,
1994,8.1,Articles,"Gans, Joshua S. | Shepherd, George B.",How Are the Mighty Fallen: Rejected Classic Articles by Leading Economists,https://www.aeaweb.org/atypon.php?return_to=/doi/pdfplus/10.1257%2Fjep.8.1.165,
1994,8.1,Features,"Addison, John T. | Blackburn, McKinley L.",The Worker Adjustment and Retraining Notification Act,https://www.aeaweb.org/atypon.php?return_to=/doi/pdfplus/10.1257%2Fjep.8.1.181,
1994,8.1,Features,"Saffran, Bernard",Recommendations for Further Reading,https://www.aeaweb.org/atypon.php?return_to=/doi/pdfplus/10.1257%2Fjep.8.1.191,
1994,8.1,Features,"Friedman, Milton",Correspondence: National Science Foundation Grants for Economics,https://www.aeaweb.org/atypon.php?return_to=/doi/pdfplus/10.1257%2Fjep.8.1.199,
1994,8.1,Features,,Notes,https://www.aeaweb.org/atypon.php?return_to=/doi/pdfplus/10.1257%2Fjep.8.1.207,
1994,8.2,Front Matter,,Front Matter,https://www.aeaweb.org/atypon.php?return_to=/doi/pdfplus/10.1257%2Fjep.8.2.i,
1994,8.2,Lecture,"Aaron, Henry J.","Distinguished Lecture on Economics in Government: Public Policy, Values, and Consciousness",https://www.aeaweb.org/atypon.php?return_to=/doi/pdfplus/10.1257%2Fjep.8.2.3,
1994,8.2,Symposium: China,"Perkins, Dwight H.",Completing China's Move to the Market,https://www.aeaweb.org/atypon.php?return_to=/doi/pdfplus/10.1257%2Fjep.8.2.23,
1994,8.2,Symposium: China,"Jefferson, Gary H. | Rawski, Thomas G.",Enterprise Reform in Chinese Industry,https://www.aeaweb.org/atypon.php?return_to=/doi/pdfplus/10.1257%2Fjep.8.2.47,
1994,8.2,Symposium: China,"Yusuf, Shahid",China's Macroeconomic Performance and Management during Transition,https://www.aeaweb.org/atypon.php?return_to=/doi/pdfplus/10.1257%2Fjep.8.2.71,
1994,8.2,Symposium: Network Externalities,"Katz, Michael L. | Shapiro, Carl",Systems Competition and Network Effects,https://www.aeaweb.org/atypon.php?return_to=/doi/pdfplus/10.1257%2Fjep.8.2.93,
1994,8.2,Symposium: Network Externalities,"Besen, Stanley M. | Farrell, Joseph",Choosing How to Compete: Strategies and Tactics in Standardization,https://www.aeaweb.org/atypon.php?return_to=/doi/pdfplus/10.1257%2Fjep.8.2.117,
1994,8.2,Symposium: Network Externalities,"Liebowitz, S. J. | Margolis, Stephen E.",Network Externality: An Uncommon Tragedy,https://www.aeaweb.org/atypon.php?return_to=/doi/pdfplus/10.1257%2Fjep.8.2.133,
1994,8.2,Articles,"Telser, Lester G.",The Usefulness of Core Theory in Economics,https://www.aeaweb.org/atypon.php?return_to=/doi/pdfplus/10.1257%2Fjep.8.2.151,
1994,8.2,Articles,"Shleifer, Andrei | Vishny, Robert W.",The Politics of Market Socialism,https://www.aeaweb.org/atypon.php?return_to=/doi/pdfplus/10.1257%2Fjep.8.2.165,
1994,8.2,Articles,"Bardhan, Pranab | Roemer, John E.",On the Workability of Market Socialism,https://www.aeaweb.org/atypon.php?return_to=/doi/pdfplus/10.1257%2Fjep.8.2.177,
1994,8.2,Articles,"Fuchs, Victor R.",Nobel Laureate: Gary S. Becker: Ideas about Facts,https://www.aeaweb.org/atypon.php?return_to=/doi/pdfplus/10.1257%2Fjep.8.2.183,
1994,8.2,Features,"Saffran, Bernard",Recommendations for Further Reading,https://www.aeaweb.org/atypon.php?return_to=/doi/pdfplus/10.1257%2Fjep.8.2.193,
1994,8.2,Features,"Williamson, Oliver",Correspondence,https://www.aeaweb.org/atypon.php?return_to=/doi/pdfplus/10.1257%2Fjep.8.2.201,
1994,8.2,Features,,Notes,https://www.aeaweb.org/atypon.php?return_to=/doi/pdfplus/10.1257%2Fjep.8.2.211,
1994,8.3,Front Matter,,Front Matter,https://www.aeaweb.org/atypon.php?return_to=/doi/pdfplus/10.1257%2Fjep.8.3.i,
1994,8.3,Symposium: Health Care Reform,"Newhouse, Joseph P.",Symposium on Health Care Reform,https://www.aeaweb.org/atypon.php?return_to=/doi/pdfplus/10.1257%2Fjep.8.3.3,
1994,8.3,Symposium: Health Care Reform,"Cutler, David M.",A Guide to Health Care Reform,https://www.aeaweb.org/atypon.php?return_to=/doi/pdfplus/10.1257%2Fjep.8.3.13,
1994,8.3,Symposium: Health Care Reform,"Aaron, Henry J.",Issues Every Plan to Reform Health Care Financing Must Confront,https://www.aeaweb.org/atypon.php?return_to=/doi/pdfplus/10.1257%2Fjep.8.3.31,
1994,8.3,Symposium: Health Care Reform,"Pauly, Mark V.",Universal Health Insurance in the Clinton Plan: Coverage as a Tax-Financed Public Good,https://www.aeaweb.org/atypon.php?return_to=/doi/pdfplus/10.1257%2Fjep.8.3.45,
1994,8.3,Symposium: Health Care Reform,"Zeckhauser, Richard",Public Finance Principles and National Health Care Reform,https://www.aeaweb.org/atypon.php?return_to=/doi/pdfplus/10.1257%2Fjep.8.3.55,
1994,8.3,Symposium: Health Care Reform,"Diamond, Peter A.",Two Improvements on the Clinton Framework,https://www.aeaweb.org/atypon.php?return_to=/doi/pdfplus/10.1257%2Fjep.8.3.61,
1994,8.3,Symposium: Health Care Reform,"Poterba, James M.",A Skeptic's View of Global Budget Caps,https://www.aeaweb.org/atypon.php?return_to=/doi/pdfplus/10.1257%2Fjep.8.3.67,
1994,8.3,Symposium: Internet,"MacKie-Mason, Jeffrey K. | Varian, Hal",Economic FAQs About the Internet,https://www.aeaweb.org/atypon.php?return_to=/doi/pdfplus/10.1257%2Fjep.8.3.75,
1994,8.3,Symposium: Internet,"Goffe, William L.",Computer Network Resources for Economists,https://www.aeaweb.org/atypon.php?return_to=/doi/pdfplus/10.1257%2Fjep.8.3.97,
1994,8.3,Articles,"Benston, George J.",Universal Banking,https://www.aeaweb.org/atypon.php?return_to=/doi/pdfplus/10.1257%2Fjep.8.3.121,
1994,8.3,Articles,"McMillan, John",Selling Spectrum Rights,https://www.aeaweb.org/atypon.php?return_to=/doi/pdfplus/10.1257%2Fjep.8.3.145,
1994,8.3,Articles,"Montgomery, Cynthia A.",Corporate Diversificaton,https://www.aeaweb.org/atypon.php?return_to=/doi/pdfplus/10.1257%2Fjep.8.3.163,
1994,8.3,Articles,"Figlio, David",Trends in the Publication of Empirical Economics,https://www.aeaweb.org/atypon.php?return_to=/doi/pdfplus/10.1257%2Fjep.8.3.179,
1994,8.3,Features,"Perelman, Michael","Retrospectives: Fixed Capital, Railroad Economics and the Critique of the Market",https://www.aeaweb.org/atypon.php?return_to=/doi/pdfplus/10.1257%2Fjep.8.3.189,
1994,8.3,Features,,Recommendations for Futher Reading,https://www.aeaweb.org/atypon.php?return_to=/doi/pdfplus/10.1257%2Fjep.8.3.197,
1994,8.3,Features,,Correspondence: Should Class Attendance Be Mandatory?,https://www.aeaweb.org/atypon.php?return_to=/doi/pdfplus/10.1257%2Fjep.8.3.205,
1994,8.3,Features,,Notes,https://www.aeaweb.org/atypon.php?return_to=/doi/pdfplus/10.1257%2Fjep.8.3.217,
1994,8.4, ,,Front Matter,https://www.aeaweb.org/atypon.php?return_to=/doi/pdfplus/10.1257%2Fjep.8.4.i,
1994,8.4,Symposium: Contingent Valuation,"Portney, Paul R.",The Contingent Valuation Debate: Why Economists Should Care,https://www.aeaweb.org/atypon.php?return_to=/doi/pdfplus/10.1257%2Fjep.8.4.3,
1994,8.4,Symposium: Contingent Valuation,"Hanemann, W. Michael",Valuing the Environment through Contingent Valuation,https://www.aeaweb.org/atypon.php?return_to=/doi/pdfplus/10.1257%2Fjep.8.4.19,
1994,8.4,Symposium: Contingent Valuation,"Diamond, Peter A. | Hausman, Jerry A.",Contingent Valuation: Is Some Number Better than No Number?,https://www.aeaweb.org/atypon.php?return_to=/doi/pdfplus/10.1257%2Fjep.8.4.45,
1994,8.4,Symposium: Defense Procurement,"Rogerson, William P.",Economic Incentives and the Defense Procurement Process,https://www.aeaweb.org/atypon.php?return_to=/doi/pdfplus/10.1257%2Fjep.8.4.65,
1994,8.4,Symposium: Defense Procurement,"Kovacic, William E. | Smallwood, Dennis E.","Competition Policy, Rivalries, and Defense Industry Consolidation",https://www.aeaweb.org/atypon.php?return_to=/doi/pdfplus/10.1257%2Fjep.8.4.91,
1994,8.4,Articles,"Scarf, Herbert",The Allocation of Resources in the Presence of Indivisibilities,https://www.aeaweb.org/atypon.php?return_to=/doi/pdfplus/10.1257%2Fjep.8.4.111,
1994,8.4,Articles,"Frank, Richard G. | Salkever, David S.",Nonprofit Organizations in the Health Sector,https://www.aeaweb.org/atypon.php?return_to=/doi/pdfplus/10.1257%2Fjep.8.4.129,
1994,8.4,Articles,"Gale, William G. | Scholz, John Karl",Intergenerational Transfers and the Accumulation of Wealth,https://www.aeaweb.org/atypon.php?return_to=/doi/pdfplus/10.1257%2Fjep.8.4.145,
1994,8.4,Articles,"Arrow, Kenneth J. | Kehoe, Timothy J.",Distinguished Fellow: Herbert Scarf's Contributions to Economics,https://www.aeaweb.org/atypon.php?return_to=/doi/pdfplus/10.1257%2Fjep.8.4.161,
1994,8.4,Features,"Blank, Rebecca M.",Policy Watch: Proposals for Time-Limited Welfare,https://www.aeaweb.org/atypon.php?return_to=/doi/pdfplus/10.1257%2Fjep.8.4.183,
1994,8.4,Features,"Saffran, Bernard",Recommendations for Further Reading,https://www.aeaweb.org/atypon.php?return_to=/doi/pdfplus/10.1257%2Fjep.8.4.195,
1994,8.4,Features,"Sumner, Scott",Correspondence,https://www.aeaweb.org/atypon.php?return_to=/doi/pdfplus/10.1257%2Fjep.8.4.201,
1994,8.4,Features,,Notes,https://www.aeaweb.org/atypon.php?return_to=/doi/pdfplus/10.1257%2Fjep.8.4.207,
1994,8.4,Features,,Index for Volume 8,https://www.aeaweb.org/atypon.php?return_to=/doi/pdfplus/10.1257%2Fjep.8.4.215,
1995,9.1,Front Matter,,Front Matter,https://www.aeaweb.org/atypon.php?return_to=/doi/pdfplus/10.1257%2Fjep.9.1.i,
1995,9.1,Symposium: Economics of Voting,"Levin, Jonathan | Nalebuff, Barry",An Introduction to Vote-Counting Schemes,https://www.aeaweb.org/atypon.php?return_to=/doi/pdfplus/10.1257%2Fjep.9.1.3,
1995,9.1,Symposium: Economics of Voting,"Tideman, Nicolaus",The Single Transferable Vote,https://www.aeaweb.org/atypon.php?return_to=/doi/pdfplus/10.1257%2Fjep.9.1.27,
1995,9.1,Symposium: Economics of Voting,"Weber, Robert J.",Approval Voting,https://www.aeaweb.org/atypon.php?return_to=/doi/pdfplus/10.1257%2Fjep.9.1.39,
1995,9.1,Symposium: Economics of Voting,"Young, Peyton",Optimal Voting Rules,https://www.aeaweb.org/atypon.php?return_to=/doi/pdfplus/10.1257%2Fjep.9.1.51,
1995,9.1,Symposium: Economics of Voting,"Rae, Douglas W.",Using District Magnitude to Regulate Political Party Competition,https://www.aeaweb.org/atypon.php?return_to=/doi/pdfplus/10.1257%2Fjep.9.1.65,
1995,9.1,Symposium: Economics of Voting,"Myerson, Roger B.","Analysis of Democratic Institutions: Structure, Conduct and Performance",https://www.aeaweb.org/atypon.php?return_to=/doi/pdfplus/10.1257%2Fjep.9.1.77,
1995,9.1,Symposium: Economics of Voting,"Sen, Amartya",How to Judge Voting Schemes,https://www.aeaweb.org/atypon.php?return_to=/doi/pdfplus/10.1257%2Fjep.9.1.91,
1995,9.1,Articles,"Arnott, Richard",Time for Revisionism on Rent Control?,https://www.aeaweb.org/atypon.php?return_to=/doi/pdfplus/10.1257%2Fjep.9.1.99,
1995,9.1,Articles,"Metcalf, Gilbert E.",Value-Added Taxation: A Tax Whose Time Has Come?,https://www.aeaweb.org/atypon.php?return_to=/doi/pdfplus/10.1257%2Fjep.9.1.121,
1995,9.1,Articles,"Huberman, Bernardo A. | Hogg, Tad",Distributed Computation as an Economic System,https://www.aeaweb.org/atypon.php?return_to=/doi/pdfplus/10.1257%2Fjep.9.1.141,
1995,9.1,Articles,"Hinshaw, C. Elton | Siegfried, John J.",Who Gets on the AEA Program?,https://www.aeaweb.org/atypon.php?return_to=/doi/pdfplus/10.1257%2Fjep.9.1.153,
1995,9.1,Articles,"Poterba, James M.","In Honor of Lawrence H. Summers, Winner of the John Bates Clark Medal",https://www.aeaweb.org/atypon.php?return_to=/doi/pdfplus/10.1257%2Fjep.9.1.165,
1995,9.1,Features,"Levitt, Steven D.",Policy Watch: Congressional Campaign Finance Reform,https://www.aeaweb.org/atypon.php?return_to=/doi/pdfplus/10.1257%2Fjep.9.1.183,
1995,9.1,Features,"Saffran, Bernard",Recommendations for Further Reading,https://www.aeaweb.org/atypon.php?return_to=/doi/pdfplus/10.1257%2Fjep.9.1.195,
1995,9.1,Features,"Eichenberger, Reiner | Frey, Bruno | Haucap, Justus",Correspondence,https://www.aeaweb.org/atypon.php?return_to=/doi/pdfplus/10.1257%2Fjep.9.1.203,
1995,9.1,Features,,Notes,https://www.aeaweb.org/atypon.php?return_to=/doi/pdfplus/10.1257%2Fjep.9.1.213,
1995,9.2,Front Matter,,Front Matter,https://www.aeaweb.org/atypon.php?return_to=/doi/pdfplus/10.1257%2Fjep.9.2.i,
1995,9.2,Symposium: Immigration,"Borjas, George J.",The Economic Benefits from Immigration,https://www.aeaweb.org/atypon.php?return_to=/doi/pdfplus/10.1257%2Fjep.9.2.3,
1995,9.2,Symposium: Immigration,"Friedberg, Rachel M. | Hunt, Jennifer","The Impact of Immigrants on Host Country Wages, Employment and Growth",https://www.aeaweb.org/atypon.php?return_to=/doi/pdfplus/10.1257%2Fjep.9.2.23,
1995,9.2,Symposium: Immigration,"Zimmermann, Klaus F.",Tackling the European Migration Problems,https://www.aeaweb.org/atypon.php?return_to=/doi/pdfplus/10.1257%2Fjep.9.2.45,
1995,9.2,Symposium: Social Experiments,"Burtless, Gary",The Case for Randomized Field Trials in Economic and Policy Research,https://www.aeaweb.org/atypon.php?return_to=/doi/pdfplus/10.1257%2Fjep.9.2.63,
1995,9.2,Symposium: Social Experiments,"Heckman, James J. | Smith, Jeffrey A.",Assessing the Case for Social Experiments,https://www.aeaweb.org/atypon.php?return_to=/doi/pdfplus/10.1257%2Fjep.9.2.85,
1995,9.2,Articles,"Dreze, Jacques H.",Forty Years of Public Economics: A Personal Perspective,https://www.aeaweb.org/atypon.php?return_to=/doi/pdfplus/10.1257%2Fjep.9.2.111,
1995,9.2,Articles,"Nelson, Julie A.",Feminism and Economics,https://www.aeaweb.org/atypon.php?return_to=/doi/pdfplus/10.1257%2Fjep.9.2.131,
1995,9.2,Articles,"LaLonde, Robert J.",The Promise of Public Sector-Sponsored Training Programs,https://www.aeaweb.org/atypon.php?return_to=/doi/pdfplus/10.1257%2Fjep.9.2.149,
1995,9.2,Articles,"Markusen, James R.",The Boundaries of Multinational Enterprises and the Theory of International Trade,https://www.aeaweb.org/atypon.php?return_to=/doi/pdfplus/10.1257%2Fjep.9.2.169,
1995,9.2,Articles,"Goldin, Claudia",Cliometrics and the Nobel,https://www.aeaweb.org/atypon.php?return_to=/doi/pdfplus/10.1257%2Fjep.9.2.191,
1995,9.2,Features,"Camerer, Colin F. | Thaler, Richard H.","Anomalies: Ultimatums, Dictators and Manners",https://www.aeaweb.org/atypon.php?return_to=/doi/pdfplus/10.1257%2Fjep.9.2.209,
1995,9.2,Features,"Persky, Joseph",The Ethology of Homo Economicus,https://www.aeaweb.org/atypon.php?return_to=/doi/pdfplus/10.1257%2Fjep.9.2.221,
1995,9.2,Features,,Recommendations for Futher Reading,https://www.aeaweb.org/atypon.php?return_to=/doi/pdfplus/10.1257%2Fjep.9.2.233,
1995,9.2,Features,"Guy, Frederick",Correspondence,https://www.aeaweb.org/atypon.php?return_to=/doi/pdfplus/10.1257%2Fjep.9.2.243,
1995,9.2,Features,,Notes,https://www.aeaweb.org/atypon.php?return_to=/doi/pdfplus/10.1257%2Fjep.9.2.247,
1995,9.3,Front Matter,,Front Matter,https://www.aeaweb.org/atypon.php?return_to=/doi/pdfplus/10.1257%2Fjep.9.3.i,
1995,9.3,Lecture,"Sawhill, Isabel V.",Distinguished Lecture on Economics in Government: The Economist vs. Madmen in Authority,https://www.aeaweb.org/atypon.php?return_to=/doi/pdfplus/10.1257%2Fjep.9.3.3,
1995,9.3,Symposium: Income Inequality and Trade,"Freeman, Richard B.",Are Your Wages Set in Beijing?,https://www.aeaweb.org/atypon.php?return_to=/doi/pdfplus/10.1257%2Fjep.9.3.15,
1995,9.3,Symposium: Income Inequality and Trade,"Richardson, J. David","Income Inequality and Trade: How to Think, What to Conclude",https://www.aeaweb.org/atypon.php?return_to=/doi/pdfplus/10.1257%2Fjep.9.3.33,
1995,9.3,Symposium: Income Inequality and Trade,"Wood, Adrian",How Trade Hurt Unskilled Workers,https://www.aeaweb.org/atypon.php?return_to=/doi/pdfplus/10.1257%2Fjep.9.3.57,
1995,9.3,Symposium: Consumption Smoothing in Developing Countries,"Case, Anne",Symposium on Consumption Smoothing in Developing Countries,https://www.aeaweb.org/atypon.php?return_to=/doi/pdfplus/10.1257%2Fjep.9.3.81,
1995,9.3,Symposium: Consumption Smoothing in Developing Countries,"Townsend, Robert M.",Consumption Insurance: An Evaluation of Risk-Bearing Systems in Low-Income Economies,https://www.aeaweb.org/atypon.php?return_to=/doi/pdfplus/10.1257%2Fjep.9.3.83,
1995,9.3,Symposium: Consumption Smoothing in Developing Countries,"Morduch, Jonathan",Income Smoothing and Consumption Smoothing,https://www.aeaweb.org/atypon.php?return_to=/doi/pdfplus/10.1257%2Fjep.9.3.103,
1995,9.3,Symposium: Consumption Smoothing in Developing Countries,"Besley, Timothy",Nonmarket Institutions for Credit and Risk Sharing in Low-Income Countries,https://www.aeaweb.org/atypon.php?return_to=/doi/pdfplus/10.1257%2Fjep.9.3.115,
1995,9.3,Articles,"Campbell, John Y.",Some Lessons from the Yield Curve,https://www.aeaweb.org/atypon.php?return_to=/doi/pdfplus/10.1257%2Fjep.9.3.129,
1995,9.3,Articles,"Blanchflower, David G. | Oswald, Andrew J.",An Introduction to the Wage Curve,https://www.aeaweb.org/atypon.php?return_to=/doi/pdfplus/10.1257%2Fjep.9.3.153,
1995,9.3,Articles,"Colander, David",The Stories We Tell: A Reconsideration of AS/AD Analysis,https://www.aeaweb.org/atypon.php?return_to=/doi/pdfplus/10.1257%2Fjep.9.3.169,
1995,9.3,Features,"Perelman, Michael","Retrospectives: Schumpeter, David Wells, and Creative Destruction",https://www.aeaweb.org/atypon.php?return_to=/doi/pdfplus/10.1257%2Fjep.9.3.189,
1995,9.3,Features,"Christie, William G. | Schultz, Paul H.",Policy Watch: Did Nasdaq Market Makers Implicitly Collude?,https://www.aeaweb.org/atypon.php?return_to=/doi/pdfplus/10.1257%2Fjep.9.3.199,
1995,9.3,Features,,Recommendations for Further Reading,https://www.aeaweb.org/atypon.php?return_to=/doi/pdfplus/10.1257%2Fjep.9.3.209,
1995,9.3,Features,,Notes,https://www.aeaweb.org/atypon.php?return_to=/doi/pdfplus/10.1257%2Fjep.9.3.217,
1995,9.4,Front Matter,,Front Matter,https://www.aeaweb.org/atypon.php?return_to=/doi/pdfplus/10.1257%2Fjep.9.4.i,
1995,9.4,Symposium: The Monetary Transmission Mechanism,"Mishkin, Frederic S.",Symposium on the Monetary Transmission Mechanism,https://www.aeaweb.org/atypon.php?return_to=/doi/pdfplus/10.1257%2Fjep.9.4.3,
1995,9.4,Symposium: The Monetary Transmission Mechanism,"Taylor, John B.",The Monetary Transmission Mechanism: An Empirical Framework,https://www.aeaweb.org/atypon.php?return_to=/doi/pdfplus/10.1257%2Fjep.9.4.11,
1995,9.4,Symposium: The Monetary Transmission Mechanism,"Bernanke, Ben S. | Gertler, Mark",Inside the Black Box: The Credit Channel of Monetary Policy Transmission,https://www.aeaweb.org/atypon.php?return_to=/doi/pdfplus/10.1257%2Fjep.9.4.27,
1995,9.4,Symposium: The Monetary Transmission Mechanism,"Meltzer, Allan H.","Monetary, Credit and (Other) Transmission Processes: A Monetarist Perspective",https://www.aeaweb.org/atypon.php?return_to=/doi/pdfplus/10.1257%2Fjep.9.4.49,
1995,9.4,Symposium: The Monetary Transmission Mechanism,"Obstfeld, Maurice | Rogoff, Kenneth",The Mirage of Fixed Exchange Rates,https://www.aeaweb.org/atypon.php?return_to=/doi/pdfplus/10.1257%2Fjep.9.4.73,
1995,9.4,Symposium: Might Environmental Regulation Promote Growth?,"Porter, Michael E. | van der Linde, Claas",Toward a New Conception of the Environment-Competitiveness Relationship,https://www.aeaweb.org/atypon.php?return_to=/doi/pdfplus/10.1257%2Fjep.9.4.97,
1995,9.4,Symposium: Might Environmental Regulation Promote Growth?,"Palmer, Karen | Oates, Wallace E. | Portney, Paul R.",Tightening Environmental Standards: The Benefit-Cost or the No-Cost Paradigm?,https://www.aeaweb.org/atypon.php?return_to=/doi/pdfplus/10.1257%2Fjep.9.4.119,
1995,9.4,Articles,"Weiss, Andrew",Human Capital vs. Signalling Explanations of Wages,https://www.aeaweb.org/atypon.php?return_to=/doi/pdfplus/10.1257%2Fjep.9.4.133,
1995,9.4,Articles,"Kuran, Timur",Islamic Economics and the Islamic Subeconomy,https://www.aeaweb.org/atypon.php?return_to=/doi/pdfplus/10.1257%2Fjep.9.4.155,
1995,9.4,Articles,"Miron, Jeffrey A. | Zwiebel, Jeffrey",The Economic Case against Drug Prohibition,https://www.aeaweb.org/atypon.php?return_to=/doi/pdfplus/10.1257%2Fjep.9.4.175,
1995,9.4,Articles,"Kahn, Shulamit B.",Women in the Economics Profession,https://www.aeaweb.org/atypon.php?return_to=/doi/pdfplus/10.1257%2Fjep.9.4.193,
1995,9.4,Features,"Elmslie, Bruce Truitt",Retrospective: The Convergence Debate between David Hume and Josiah Tucker,https://www.aeaweb.org/atypon.php?return_to=/doi/pdfplus/10.1257%2Fjep.9.4.207,
1995,9.4,Features,"Hines, James R. | Thaler, Richard H.",The Flypaper Effect,https://www.aeaweb.org/atypon.php?return_to=/doi/pdfplus/10.1257%2Fjep.9.4.217,
1995,9.4,Features,,Recommendations for Further Reading,https://www.aeaweb.org/atypon.php?return_to=/doi/pdfplus/10.1257%2Fjep.9.4.227,
1995,9.4,Features,,Correspondence,https://www.aeaweb.org/atypon.php?return_to=/doi/pdfplus/10.1257%2Fjep.9.4.235,
1995,9.4,Features,,Notes,https://www.aeaweb.org/atypon.php?return_to=/doi/pdfplus/10.1257%2Fjep.9.4.241,
1995,9.4,Features,,Index by Author to Volume 9,https://www.aeaweb.org/atypon.php?return_to=/doi/pdfplus/10.1257%2Fjep.9.4.246,
1996,10.1,Front Matter,,Front Matter,https://www.aeaweb.org/atypon.php?return_to=/doi/pdfplus/10.1257%2Fjep.10.1.i,
1996,10.1,Symposium: The Economics of Crime,"DiIulio, John J.","Help Wanted: Economists, Crime and Public Policy",https://www.aeaweb.org/atypon.php?return_to=/doi/pdfplus/10.1257%2Fjep.10.1.3,
1996,10.1,Symposium: The Economics of Crime,"Freeman, Richard B.",Why Do So Many Young American Men Commit Crimes and What Might We Do about It?,https://www.aeaweb.org/atypon.php?return_to=/doi/pdfplus/10.1257%2Fjep.10.1.25,
1996,10.1,Symposium: The Economics of Crime,"Ehrlich, Isaac","Crime, Punishment, and the Market for Offenses",https://www.aeaweb.org/atypon.php?return_to=/doi/pdfplus/10.1257%2Fjep.10.1.43,
1996,10.1,Symposium: Computational Experiments in Macroeconomics,"Kydland, Finn E. | Prescott, Edward C.",The Computational Experiment: An Econometric Tool,https://www.aeaweb.org/atypon.php?return_to=/doi/pdfplus/10.1257%2Fjep.10.1.69,
1996,10.1,Symposium: Computational Experiments in Macroeconomics,"Hansen, Lars Peter | Heckman, James J.",The Empirical Foundations of Calibration,https://www.aeaweb.org/atypon.php?return_to=/doi/pdfplus/10.1257%2Fjep.10.1.87,
1996,10.1,Symposium: Computational Experiments in Macroeconomics,"Sims, Christopher A.",Macroeconomics and Methodology,https://www.aeaweb.org/atypon.php?return_to=/doi/pdfplus/10.1257%2Fjep.10.1.105,
1996,10.1,Articles,"Darity, William A. | Goldsmith, Arthur H.","Social Psychology, Unemployment and Macroeconomics",https://www.aeaweb.org/atypon.php?return_to=/doi/pdfplus/10.1257%2Fjep.10.1.121,
1996,10.1,Articles,"Auerbach, Alan J.",Dynamic Revenue Estimation,https://www.aeaweb.org/atypon.php?return_to=/doi/pdfplus/10.1257%2Fjep.10.1.141,
1996,10.1,Articles,"McAfee, R. Preston | McMillan, John",Analyzing the Airwaves Auction,https://www.aeaweb.org/atypon.php?return_to=/doi/pdfplus/10.1257%2Fjep.10.1.159,
1996,10.1,Articles,"Yezer, Anthony M. | Goldfarb, Robert S. | Poppen, Paul J.","Does Studying Economics Discourage Cooperation? Watch What We Do, Not What We Say or How We Play",https://www.aeaweb.org/atypon.php?return_to=/doi/pdfplus/10.1257%2Fjep.10.1.177,
1996,10.1,Articles,"Frank, Robert H. | Gilovich, Thomas D. | Regan, Dennis T.",Do Economists Make Bad Citizens?,https://www.aeaweb.org/atypon.php?return_to=/doi/pdfplus/10.1257%2Fjep.10.1.187,
1996,10.1,Features,"Holt, Charles A.",Classroom Games: Trading in a Pit Market,https://www.aeaweb.org/atypon.php?return_to=/doi/pdfplus/10.1257%2Fjep.10.1.193,
1996,10.1,Features,,Recommendations for Further Reading,https://www.aeaweb.org/atypon.php?return_to=/doi/pdfplus/10.1257%2Fjep.10.1.205,
1996,10.1,Features,,Notes,https://www.aeaweb.org/atypon.php?return_to=/doi/pdfplus/10.1257%2Fjep.10.1.213,
1996,10.2,Front Matter,,Front Matter,https://www.aeaweb.org/atypon.php?return_to=/doi/pdfplus/10.1257%2Fjep.10.2.i,
1996,10.2,Lecture,"Olson, Mancur","Distinguished Lecture on Economics in Government: Big Bills Left on the Sidewalk: Why Some Nations Are Rich, and Others Poor",https://www.aeaweb.org/atypon.php?return_to=/doi/pdfplus/10.1257%2Fjep.10.2.3,
1996,10.2,Symposium: Transition from Socialism,"Murrell, Peter",How Far Has the Transition Progressed?,https://www.aeaweb.org/atypon.php?return_to=/doi/pdfplus/10.1257%2Fjep.10.2.25,
1996,10.2,Symposium: Transition from Socialism,"Fischer, Stanley | Sahay, Ratna | Vegh, Carlos A.",Stabilization and Growth in Transition Economies: The Early Experience,https://www.aeaweb.org/atypon.php?return_to=/doi/pdfplus/10.1257%2Fjep.10.2.45,
1996,10.2,Symposium: Transition from Socialism,"Brada, Josef C.",Privatization Is Transition--Or Is It?,https://www.aeaweb.org/atypon.php?return_to=/doi/pdfplus/10.1257%2Fjep.10.2.67,
1996,10.2,Symposium: Transition from Socialism,"Rapaczynski, Andrzej",The Roles of the State and the Market in Establishing Property Rights,https://www.aeaweb.org/atypon.php?return_to=/doi/pdfplus/10.1257%2Fjep.10.2.87,
